{
  "assignment_id": "asg_001",
  "booking_id": "bkg_goa_001",
  "canonical_id": "cp_goa_4d",
  "eligibility": {
    "pool_size": 4,
    "freshness_ok": true,
    "lead_days": 9,
    "match_pct": 0.84,
    "auto_confirm": true
  },
  "decision": {
    "scores": [
      {
        "supplier_id": "sup_b",
        "reliability": 0.93,
        "capacity": 1,
        "margin": 0.18,
        "fairness_rotation": 0.2,
        "total": 0.81,
        "rule_id": "alloc_r3"
      },
      {
        "supplier_id": "sup_d",
        "reliability": 0.88,
        "capacity": 1,
        "margin": 0.2,
        "fairness_rotation": 0.3,
        "total": 0.79,
        "rule_id": "alloc_r3"
      }
    ],
    "assigned": "sup_b",
    "decided_by": "rules",
    "ts": "2026-09-20T09:15:00Z"
  },
  "cascade": [
    {
      "supplier_id": "sup_b",
      "offered_ts": "2026-09-20T09:15:00Z",
      "accept_deadline_ts": "2026-09-20T13:15:00Z",
      "outcome": "declined"
    },
    {
      "supplier_id": "sup_d",
      "offered_ts": "2026-09-20T13:20:00Z",
      "accept_deadline_ts": "2026-09-20T17:20:00Z",
      "outcome": "accepted"
    }
  ],
  "sla": {
    "voucher_due_ts": "2026-09-21T09:15:00Z",
    "breach_ts": "2026-09-22T09:15:00Z",
    "deadman_ts": "2026-09-23T09:15:00Z",
    "alerts": {
      "amber_ts": "2026-09-20T21:15:00Z",
      "red_ts": "2026-09-21T09:15:00Z"
    }
  },
  "status": "accepted"
}
